{
  "asset_entry_id": "ae_run_p4_full_texture_albedo",
  "op_id": "op_import_ae_run_p4_full_texture_albedo",
  "asset_kind": "texture",
  "bridge_mode": "bridge_python",
  "status": "success",
  "timestamp": "2026-05-26T20:05:14.183Z",
  "source_uri_abs": "D:\\UnrealProjects\\Mvpv4TestCodex\\Plugins\\AgentBridge\\Tests\\fixtures\\forgeue_manifest\\payload\\tex_albedo.png",
  "uasset_object_path": "/Game/Generated/Tavern/run_p4_full/T_run_p4_full_tex_albedo.T_run_p4_full_tex_albedo",
  "uasset_package_path": "/Game/Generated/Tavern/run_p4_full/T_run_p4_full_tex_albedo",
  "factory_class": "unreal.TextureFactory",
  "duration_ms": 62,
  "import_log_excerpt": "imported texture from tex_albedo.png + applied 6 options",
  "errors": []
}